<?xml version="1.0" encoding="UTF-8"?>
<visite xmlns:xsi="http://www.w3.org/2001/XMLSchema-instance" xsi:noNamespaceSchemaLocation="visite.xsd">
  <visita id="1">
    <nome>Naturalistico</nome>
    <data>2025-01-03</data>
    <ora>15:00</ora>
  </visita>
  <visita id="2">
    <nome>Archeologico</nome>
    <data>2025-01-03</data>
    <ora>16:00</ora>
  </visita>
  <visita id="3">
    <nome>Storico-Artistico</nome>
    <data>2025-03-02</data>
    <ora>14:09</ora>
  </visita>
  <visita id="4">
    <nome>Naturalistico</nome>
    <data>2025-02-23</data>
    <ora>16:33</ora>
  </visita>
</visite>
